no,nama,harga,stock
334,Keyboard Gaming Mechanical ALTEC LANSING ALGK-8404 FQ Wired RGB,302000,17
335,Keyboard Gaming Alcatroz X-Craft XKB 300 Spill Proof -Bakclight effect,124000,500
336,HP KM100 Keyboard Mouse Gaming Combo,139000,20
337,Leopard G20 Gaming Keyboard LED,80800,200
338,Keyboard Gaming NYK K06 K 06 TKL Rainbow,105000,50
339,Bekas - SteelSeries Apex 7 TKL Mechanical Gaming Keyboard,1190000,4
340,Keyboard Gaming ALTEC LANSING ALGK-8264 Wired- ALTEC Lansing ALGK 8264,141000,5
341,Digital alliance Gaming Keyboard Meca Air S White And Blue,349000,10
342,Rexus Keyboard Gaming Mechanical Daiva D68SF South Facing,579000,10
343,Paket Gaming Keyboard dan Mouse RGB Set Gaming Mouse dan Keyboard USB Cable,165000,9291
344,Baseus Gamo GK01 Gaming Keyboard - Mechanical Game Gamers One Handed Operation Original,277200,10
345,Keyboard Gaming Multimedia Membrane AULA F2028 RGB Macro Software,256600,100
346,Keyboard Gaming Rexus Legionare MX5.2 TKL Strato Black 9 Mode Lighting,369000,20
347,HP GK200 Mechanical Gaming Keyboard Blue Switch,306000,30
348,Keyboard Mouse Gaming Rexus Warfaction Vr1 Backlight,199000,9
349,Fantech K613L Fighter II Full Size Edition Gaming Keyboard,176500,14
350,New Paket Gaming Bundling Murah Leopard G20 Gaming Keyboard LED  AULA Mouse Pad Gaming Mouse Gaming USB dengan LED Q1q,237700,96
351,PAKET KEYBORD GAMING DAN MOUSE GAMING USB MIXIE X90A FREE HEADSET GAMING WEILISHI W-160,249900,99993
352,Digital Alliance Keyboard Gaming Meca 6 GREY WHITE RGB LED Colors,325000,10
353,Fantech Combo P31 3 in 1 - Gaming keyboard/ Mouse/ Mousepad,195000,97
354,Fantech K511 Hunter Pro Keyboard Gaming,118000,18
355,Keyboard Gaming Leopard G700 dengan LED dan Smartphone Holder,98900,5
356,Keyboard Asus ROG G771 G771j G771jm G771jw GL752 GL752v GL752vl GL752vm Gl752vw ZX50 gaming,320000,999
357,PAKET KEYBOARD VOTRE DAN MOUSE VOTRE GAMING USB FREE MOUSEPAD RAZER,79900,188873
358,Keyboard Mechanical Gaming TKL Armaggeddon MKA-5R RGB - Garansi Resmi 2 Tahun,459000,100
359,HyperX Alloy FPS RGB Mechanical Gaming Keyboard Silver Switch-NA Key,1340000,100
360,Fantech ALUCASE for Maxfit61 60% MK857 Keyboard Gaming Mechanical,699000,10
361,Keyboard Rexus M71 Daxa Mini Mechanical Gaming Komputer PC M71 Switch,594000,100
362,Keyboard Gaming Mechanical Armaggeddon MKA 9C Pro Psycheagle,349000,2
363,Keyboard Gaming Fantech Maxpower MK853 Mechanical Gaming Keyboard,429000,5
364,Keyboard Cover Protector Lenovo IdeaPad Gaming 3 3i,120000,10
365,Keyboard Gaming Mechanical Fantech Maxfit87 MK856 Hotswap RGB,615000,50
366,HP Keyboard Gaming K500Y - Membrane Backlight Rainbow,177500,10
367,Rexus Legionare MX5 Keyboard Gaming Mechanical - Original garansi resmi,380000,70
368,Fantech KX302 MAJOR Keyboard Mouse Gaming Combo Bundle,215000,3
369,Keyboard Gaming LED - G20,70800,50
370,Armaggeddon AK6770 KALASHNIKOV Gaming Membrane Keyboard and Gaming Mouse Combo,159000,100
371,Logitech G213 Prodigy RGB Gaming Keyboard,649000,5
372,PAKET KEYBOARD HP DAN MOUSE GAMING LED DAN MOUSEPAD LOGITECH,105000,100000
