no,nama,harga,stock
1,Paket Gaming Keyboard dan Mouse RGB / Set Gaming Mouse dan Keyboard USB Cable RGB,127000,222
2,PAKET KEYBOARD GAMING MOUSE GAMING USB 1 set keyboard Mouse,87120,887
3,paket gaming keyboard dan mouse led shopadoo m416,97020,971
4,PAKET KEYBOARD GAMING Dan MOUSE GAMING USB MIXIE X90A,87900,1134
5,KEYBOARD DAN MOUSE GAMING RAINBOW LED,175000,93
6,PAKET KEYBOARD GAMING MOUSE GAMING USB 1 Set Keyboard MOUSE,87120,132
7,paket gaming keyboard dan mouse led shopadoo m416,97020,971
8,DELIVE Luminated keyboard and mouse G21wired usb gaming keyboard set computer manipulator sense backlit metal keyboard mouse set,69900,25
9,Paket Gaming Keyboard dan Mouse Mekanik Kabel Usb Backlight Warna-warni - 1 set Keyboard dan Mouse,85000,153
10,KEYBOARD GAMING NYK K-02,105000,47
11,keyboard gaming imperion warrior 10 kg-w10c,104750,9316
12,PAKET KEYBOARD GAMING MOUSE GAMING USB 1 set keyboard Mouse,87120,887
13,Rexus Keyboard Gaming Mechanical Legionare MX9 TKL RGB,419000,4
14,JOYSEUS JMP01 Alas Mouse Tahan Air Gaming Keyboard Bantalan,18900,283
15,Keyboard Mouse Gaming Rexus VR1,195000,10
16,KEYBOARD GAMING NYK SACRED K-02,110000,499
17,KEYBOARD GAMING NYK LEGION K-01,120000,494
18,KEYBOARD GAMING IMPERION SLEDGEHAMMER 10,120000,499
19,Keyboard HP Pavilion gaming 15cx 15-cx 15-cx0055tx 15-cx0056wm.,110987,99
20,KEYBOARD GAMING IMPERION SLEDGEHAMMER 7,120000,500
21,(SERUNI) Keyboard gaming GAMEN Titan II Mechanical Pluggable Switch,266000,9
22,Keyboard Gaming NYK Nemesis Eris K-06 RGB Wired With Phone Holder,135000,39
23,Paket Keyboard Mouse Gaming RGB - Holder Smartphone - LIMEIDE T21,159800,200
24,Paket Gaming Keyboard dan Mouse Mekanik Kabel Usb Backlight Warna-warni - 1 set Keyboard dan Mouse,85000,178
25,Fantech K613 FIGHTER TKL II - Gaming Keyboard,165000,8
26,Paket Keyboard Mouse Gaming - Combo Gaming Keyboard RGB n Mouse - HXB GTX300,89900,905
27,PAKET KEYBOARD GAMING DAN MOUSE GAMING USB COMBO SET G21B LAMPU LED,99900,99971
28,Fantech K511 Hunter Pro Keyboard Gaming,118000,12
29,PAKET KEYBOARD GAMING DAN MOUSE GAMING USB MIXIE X90A FREE MOUSEPAD RAZER,99900,188874
30,Mouse keyboard gaming NB wired usb 2.0 bundle combo set membrane fullsize 2400dpi optical led lycan eagle mark,95040,1552
31,Keyboard Gaming G210 With LED Backlit,89000,7
32,Paket Gaming Keyboard dan Mouse Mekanik Kabel Usb Backlight Warna-warni - 1 set Keyboard dan Mouse,85000,153
33,Rexus Keyboard Gaming Mechanical Legionare MX9 TKL RGB,419000,4
34,Rexus Warfaction VR1 3 in 1 Pack Gaming Keyboard + Mouse + Mousepad,215000,99
35,Keyboard Bluetooth Gaming Mechanical Rexus Daxa M64/ M-64 Ultimate RGB,999000,2
36,Keyboard Gaming HP K500Y - RGB Membrane-Rubber Dump Keyboard,169000,94
37,Keyboard Gaming RGB LED Wired LDKAI R260,108400,48
38,Keyboard Asus Vivobook Pro F570 F570z F570zd Gaming YX570 YX570u YX570z YX570ud YX570zd,220000,997
39,Keyboard Gaming Mechanical TKL Sades Khanda / Removable Switch Black,480000,91
40,Armaggeddon AK666x Kalashnikov Spill Proof Backlit Membrane Gaming Keyboard - Garansi Resmi 2 Tahun,215000,791
41,Keyboard Gaming Sades Sabre RGB TKL,175000,38
42,Keyboard Gaming NYK K-02 K02 K 02 Black Only,110000,134
43,Gaming Keyboard LED with Mouse LDKAI 832,92200,98
44,Keyboard Leopard G20 - Gaming Keyboard LED RGB,74500,492
45,Keyboard Gaming TKL Imperion SLEDGEHAMMER 7,115000,96
46,Paket Gaming Keyboard dan Mouse Mekanik Kabel Usb Backlight Warna-warni - 1 set Keyboard dan Mouse,85000,178
47,Keyboard Gaming REXUS DAIVA D68SF South Facing - RX-D68SF,579000,10
48,Rexus Keyboard Gaming Mechanical DAIVA D68SF South Facing,609000,50
49,Keyboard Gaming Rexus Legionaire MX3.2 Mechanical,349000,10
50,Keyboard Gaming Multimedia Membrane AULA F2028 RGB Macro Software,175000,93
51,Rexus Legionare MX5.2 Tenkeyless Mechanical Gaming Keyboard,559000,10
52,Rexus Keyboard Gaming Mechanical Legionare MX5 TKL,309000,10
53,Case CNC Keyboard Gaming Rexus Daxa M64 / M61 Barebone 61 Keys 64 Keys,899000,3
54,Rexus Legionare MX9P - MX9 Pudding TKL Mechanical Gaming Keyboard,799000,10
55,Paket Gaming KEYBOARD GAMING Plus MOUSE GAMING USB COMBO - 1 Set Keyboard Kabel USB Plus Mouse,85000,1887
56,Keyboard Gaming Imperion SLEDGEHAMMER 7,115000,199
57,mouse optical wireless 2.4 ghz ultra slim tipis gaming wireless keyboard model apple,35900,9839
58,Rexus Keyboard Gaming Mechanical DAIVA D68SF South Facing,609000,50
59,Keyboard Gaming Imperion Sledgehammer 7 TKL semi mechanical,118000,5
60,KEYBOARD MOUSE NYK KC 300 plus Speaker NYK SPN07  BUNDLE GAMING,341550,98
61,Keyboard gaming redragon mechanical wired usb type-c macro 60% 61 keys tkl Fizz rgb k617rgb k617 k-617,370000,2718
62,Paket Keyboard Mouse Gaming Warfaction Rexus VR1 3 in 1 Free Mousepad Rexus VR-1,215000,34
63,Rexus Warfaction VR1 3 in 1 Pack Gaming Keyboard + Mouse + Mousepad,215000,99
64,Keyboard Mouse Gaming Rexus Warfaction VR1 Backlight,215000,50
65,Redragon Mechanical Gaming Keyboard 60% FIZZ K617-R,310000,3
66,Rexus Keyboard Gaming Mechanical Legionare MX9 TKL RGB,399000,5
67,Keyboard Gaming Mechanical AULA F2067 TKL K-RGD Blue Switch New LED F-2067,260000,9
68,Keyboard Gaming Mechanical Aula S2022 26 Tombol Antighosting,265000,96
69,Keyboard Gaming Sades Sabre White-Black Version RGB TKL,190000,99
70,Keyboard Gaming Multimedia Mechanical AULA F2058,349000,91
71,Keyboard Gaming NYK K-02,140000,49
72,Paket Keyboard Mouse Gaming - Combo Keyboard RGB n Mouse - LDKAI 832,88500,495
73,Keyboard Gaming Rexus Legionare MX 5.1 Mechanical TKL,305000,9
74,Keyboard Gaming Membrane AULA F-3010 Rubber Dump-NEW R LED Software,199000,62
75,Keyboard Gaming Mechanical Digital Alliance Meca Fighter Ice SE TKL,320000,24
76,Keyboard Gaming NYK K01 / K-01 RGB TKL,120000,8
77,Leopard G20 Gaming Keyboard LED - Keyboard Komputer G20 LED - Keyboard Gaming RGB,65900,26
78,Keyboard Gaming LED Backlight With Mouse LDKAI 832,99900,9
79,Keyboard Gaming Mechanical AULA S2022 PINK  RGB Display Rainbow   Macro Software   KRGD Blue Switch   Keycap and gap backlight   uniform color,259000,99
80,Fantech MAXPOWER MK853 RGB - MK 853 MK-853 Mechanical Gaming Keyboard,409000,10
81,Paket Keyboard dan Mouse Gaming Membrane HP K130 M160,168300,98
82,PROMO Bundling Keyboard Gaming MX5.1 + Coiled Cable CC1,748000,12
83,KEYBOARD GAMING plus MOUSE GAMING USB COMBO - 1 Set Keyboard Kabel USB Plus Mouse Gaming,85000,187
84,Rexus Keyboard Gaming Mechanical Legionare MX3.2,359000,50
85,Rexus CNC Case Keyboard Gaming Daxa M64 / M61 Barebone 61 Keys 64 Keys,699000,10
86,Philips SPK6214 Gaming Keyboard Wired Rainbow,120000,3
87,SKU-1233 KEYBOARD GAMING ONE HAND T-WOLF T19 BACKLIGHT SINGLE HAND,85000,9988
88,PAKET Keyboard USB HP Dan Mouse Gaming HP M100,99000,99967
89,ROBOT Keyboard Wired Mechanical KB20 Blue Switch 63 Keys Rainbow Light / Keyboard Gaming Mekanikal FULL Anti Ghosting Port,299900,5
90,Keyboard Gaming Mechanical Imperion Slingshot KG-321 Blue Switch,225000,9
91,"FANTECH MAXFIT61 MK857, KEYBOARD 60% - Gaming Keyboard",449000,2
92,PAKET KEYBOARD VOTRE DAN MOUSE VOTRE GAMING USB FREE MOUSEPAD LOGITECH,75000,99969
93,Keyboard Asus TUF Gaming 15 FX506 FX506hc FX506hcb FX506heb FX506ic FX506lh FX506li,625000,98
94,Keyboard Gaming NYK Full Size K-02,110000,2112
95,KEYBOARD GAMING NYK SACRED K-02,110000,499
96,Keyboard Gaming Mechanical TKL Altec Lansing ALGK-8404 RGB - White Grey,320000,8
97,Keyboard Gaming Mechanical Sades Khanda RGB TKL Removable,370000,100
98,Paket USB Keyboard HP SK6533 dan HP Gaming Wired Mouse USB M100,89900,999
99,Logitech G100s Gaming Combo Keyboard & Mouse,370000,10
100,Keyboard Gaming Mechanical TKL Altec Lansing ALGK-8404 RGB - Pink White,350000,10
101,Keyboard Gaming Mechanical TKL Altec Lansing ALGK-8404 RGB - White Pink,320000,10
102,Keyboard Gaming Wireless Mechanical Low Profile DAREU EK868 Dual Mode,800000,10
103,Keyboard Gaming HP GK200 - RGB Blue Switch TKL Mechanical Keyboard,305000,92
104,Paket Keyboard Gaming + Mouse Gaming USB Divipard GMK-60,277000,100
105,New Milang T806 Steel Behemoth RGB Gaming Keyboard dan Mouse Set Combo Murah,149000,10
106,Keyboard Gaming Multimedia Mechanical AULA F2063 RGB Macro Software,359000,185
107,HP K130 GAMING KEYBOARD ORIGINAL,115999,19
108,Wristpad Redragon Gaming Wrist Rest Pad TKL Keyboard METEOR M - P036,65000,6
109,Keyboard Gaming Divipard GK-70 Kabel USB 2.0 Plus LED Lightning Metal,117000,6
110,Keyboard Mouse Gaming Rexus Warfaction Vr1 Backlight,229000,493
111,Gaming Keyboard RGB Single Hand  35 Keys,85000,200
112,KEYBOARD GAMING COMBO NYK NEMESIS DRAKE KC- 300 - BUNDLE GAMING,219000,100
113,Keyboard Gaming Mechanical AULA F-2067 TKL - K-RGD Blue Switch-New LED,279000,88
114,Armaggeddon Keyboard Mouse Gaming Combo AK6880 Kalashnikov - 3200 CPI Mouse - Garansi Resmi 2 Tahun,235000,49
115,Steelseries Apex 3 Water Resistant Gaming Keyboard,985050,19
116,PROMO MiWolf K6 Milang New RGB Gaming Keyboard Wired Murah,92900,10
117,PROMO MiWolf T520 Milang New Gaming Keyboard dan Mouse Set Combo MURAH,149000,10
118,Rexus Keyboard Gaming Mekanikal Daxa M64 Ultimate,1039000,3
119,Rexus Keyboard Gaming Mechanical Legionare MX5.2 TKL,379000,3
120,Keyboard Gaming Fullsize Rexus Battlefire K9E Rainbow,199000,10
121,PAKET KEYBOARD GAMING Dan MOUSE GAMING USB MIXIE X90A,87900,1134
122,Keyboard Protector Cover Lenovo IdeaPad Gaming 3-15 3i-15 Silikon Bening Warna Tpu Cooskin Original,50000,99
123,Gaming Keyboard & Mouse Usb RGB Magix Anti Air Murah,80000,18
124,Keyboard Gaming Membrane AULA F3010   Rubber Dump    NEW R LED    Macro Software    Metal panel    Unique appearance design with mobile phone holder.,159000,96
125,PAKET KEYBOARD GAMING Dan MOUSE GAMING USB MIXIE X90A - 1 SET - KEYBOARD USB - MOUSE WIRED,99900,1888801
126,COMBO Rexus VR3 Max Combo Keyboard Mouse Gaming Headset Warfaction,340000,7
127,SADES Sabre TKL RGB Membrane Gaming Keyboard Garansi Resmi - Hitam,186900,39
128,KEYBOARD  MOUSE GAMING IMPERION X2 MARK II RGB,165000,19
129,Keyboard Gaming Fantech MK857 Maxfit P61,469000,4
130,Sades Sabre RGB Gaming Keyboard,186900,39
131,Keyboard Gaming Mechanical Wireless Bluetooth Rexus DAXA M100X Ultimate,1450000,5
132,Keyboard Gaming Mechanical Rexus DAIVA D68 RGB UPGRADE,489000,10
133,Keyboard Gaming Mechanical Rexus MX5.1 Legionare New Edition,299000,10
134,Keyboard Gaming Mechanical Rexus Daxa M84X Ultimate / Gaming Keyboard M-84XX,2549000,2
135,Rexus Keyboard Gaming K9E / Rexus K9E,209000,100
136,Keyboard gaming Redragon wired usb 2.0 Membrane Macro rgb multimedia fullsize with wrist Rest shiva k512rgb k512,384000,999
137,Keyboard Gaming Multimedia Mechanical AULA F2058,359000,370
138,Keyboard Digital Alliance DA 001 - Wireless Membrane Gaming Keyboard,288000,50
139,Keyboard Gaming NYK K01 K-01 RGB TKL,120000,86
140,Razer BlackWidow Mechanical Gaming Keyboard Black Widow RGB,1499000,9998
141,Deepcool KG722 65% Mechanical Gaming Keyboard - Gateron Red Switch,763000,20
142,Marvo KG980 Wired Mechanical Gaming Keyboard RGB,599000,10
143,Keyboard Gaming Mechanical AULA S-2022 BLACK -New LED- Macro Software,249000,91
144,Tecware Phantom Spectre Pro RGB - Mechanical Gaming Keyboard,699000,488
145,Keyboard Gaming Imperion Trooper 7 KG-M07F Mechanical RGB,320000,8
146,Keyboard Gaming Mechanical Rexus Daxa M61 Barebone 61 Keys,1349000,3
147,Rexus Keyboard Gaming DAIVA RX-D68 . Rexus Daiva RxD68,515000,52
148,Keyboard Gaming HP K500Y RGB Membrane (Rubber Dump) Keyboard,175000,98
149,Keyboard Gaming Mechanical Hotswap Komic KG-KM870 TKL Grey-Red Switch,350000,49
150,Rexus Keyboard Gaming Mechanical M64 Classic,809000,3
151,Rexus Case Cover For Keyboard Gaming Mechanical MX9,99000,38
152,Keyboard Gaming Mekanikal DAXA M100X Ultimate,1489000,20
153,Rexus Keyboard Gaming Mechanical Daxa M84X Ultimate + Free USB Hub 329,2549000,1
154,Rexus Keyboard Gaming Mechanical Daxa M61 Barebone,1509000,3
155,PROMO Bundling Rexus Keyboard Gaming Mechanical Daxa M61 Barebone + Daxa Coiled Cable CC1 / CC-1,2268000,3
156,Fantech Hunter Pro K511 Backlit Pro Gaming Keyboard,129000,13
157,Aula F2058 Keyboard Gaming Multimedia,350000,499
158,Keyboard Gaming NYK K02 Full Size,118000,119
159,BUNDLING JOYSEUS Gaming Keyboard dan Mouse RGB - Set Gaming Mouse dan Keyboard USB Cable RGB - KEY02,145000,66
160,UGREEN 90565 Tatakan Keyboard Mouse Desk Mat Pad Mousepad Mice Gaming,97500,3
161,Rexus DAIVA RX-D68 RGB - Mechanical Gaming Keyboard,429000,7
162,Keycaps pbt redragon 104 keys double shot for keyboard gaming mechanical with key puller a111 a-111 - keycap,67000,2719
163,LDKAI Gaming Keyboard RGB LED - R260 - hitam,79300,150
164,NYK KR-301 Underglow Rubber Dome Nemesis RGB Gaming Keyboard NYK KR301,185000,97
165,Keyboard Gaming Mechanical AULA F-2067 TKL - K-RGD Blue Switch-New LED,235000,98
166,PROMO Bundling Rexus Keyboard Gaming Mechanical M64 Classic + Daxa Coiled Kabel DX-CC1 / CC1,1468000,10
167,Keyboard Gaming Mecha Hotswap Outemu TKL Komic KM870 Pink-Red Switch,350000,50
168,Keyboard Mouse Gaming Combo Altec Lansing ALGC-8264 Plug & Play USB,200000,10
169,Keyboard Gaming Mechanical TKL Altec Lansing ALGK-8404 RGB - Grey White,320000,10
170,Keyboard Gaming Mechanical Multimedia Altec Lansing ALGK-8614 RGB Light,375000,50
171,MSI VIGOR GK30 - Gaming Keyboard,459000,93
172,Fantech K513 Booster RGB Gaming Keyboard,171000,19
173,Fantech KX302S Major Gaming Keyboard and Mouse Combo,247500,19
174,Alcatroz XC-1000 Spill Proof Gaming Keyboard with 9 Backlight Effect and Gaming Mouse with 7 Colour,104000,200
175,Fantech 3 in 1 Combo P31 Gaming Keyboard Mouse Mousepad,189000,4
176,Paket Keyboard dan Mouse Kabel dgn Lampu RGB Gaming - Combo Mouse dan Keyboard - G21B,93500,199
177,Mouse pad - mousepad - mouse gaming - alas notebook laptop keyboard -  BESAR JUMBO,18500,21
178,Rexus Keyboard Gaming Mechanical Legionare MX5 TKL,309000,10
179,Keyboard gaming redragon mechanical wired usb type-c 61 keys 60% tkl led backlit free switch k630 k-630 dragonborn,344000,9318
180,Meetion RGB One Handed Keyboard Gaming,189900,11
181,Keyboard Gaming Mechanical Hotswap Komic KG-KM870 TKL Blue-Red Switch,350000,50
182,Keyboard Mouse Gaming W39 With LED Backlit,125000,1
183,Keyboard Gaming,110000,26
184,Rexus Combo Warfaction VR1 - Gaming keyboard/ Mouse/ Mousepad,191000,48
185,Keyboard Mini Kabel USB - Keybord Kiboard Kibord Komputer PC Laptop Leptop Letop Keyboard Kabel USB Gaming,80000,47
186,Keycaps CLV Color Standard - Mecha Gaming Keyboard Full Warna Custom,99000,1
187,Keyboard gaming nyk nemesis wired usb 2.0 mechanical tkl 87 keys rainbow free switch ezalor mkn-01 mkn01,318000,231
188,Digital alliance Meca Air S Wireless Gaming Keyboard,340000,19
189,Rexus MX5.2 Keyboard Gaming Mechanical TKL,359000,5
190,Redragon SCARAB A130 PBT Pudding Keycaps for Mechanical Gaming Keyboard,139000,3
191,RII Mini X1 Keyboard Wireless 2.4G Air Mouse Keyboard Touchpad Gaming,215000,30
192,Nyk K02 Sacred Gaming Keyboard Rainbow,115000,19
193,Rexus Legionare MX5.2 - Mechanical Gaming Keyboard,375000,5
194,Keyboard Gaming Logitech G213 Prodigy  Logitech Gaming Keyboard,618000,997
195,Keyboard Mouse Gaming Rexus Warfaction Vr1 Backlight,199000,48
196,Fantech Keyboard - K613L Keyboard Gaming,189000,9
197,Combo Gaming Keyboard RGB Mechanical Feel with Mouse G21B,88000,49
198,Logitech Keyboard G413 Backlit Mechanical Gaming - Garansi 2Th,936000,100
199,Keyboard Gaming Mechanical Armaggeddon MKA-2C NEO Psychraven TKL,259000,5
200,KEYBOARD MOUSE ROBOT KM4000 WIRELESS - Keybord Mause Gaming Bluetooth Mous Kibord Kiboard Mose Mos Komputer Laptop PC,210000,93
201,Keyboard gaming redragon mechanical wired usb type-c macro 60% 61 keys tkl Fizz rgb k617 k617rgb k-617,369000,2130
202,Fantech Fighter K613 TKL - RGB Gaming Keyboard,199000,15
203,KYB-018 SOHA Keyboard Single Hand Gaming Mechanical Handed RGB Rainbow Light K7,86950,1000
204,LDKAI 832 Gaming Keyboard LED Free Mouse Gaming,99900,98
205,Keyboard Bluetooth Gaming Mechanical Rexus Daxa M64/ M-64 Ultimate RGB,999000,2
206,Redragon Mechanical Wireless Gaming Keyboard WHITE GREY FIZZ -K616RGB,585000,3
207,Razer BlackWidow V3 Mechanical Gaming Keyboard,1499000,9
208,Rexus Daxa M64 Classic Mechanical Gaming Keyboard M 64,749000,100
209,Rexus Warfaction VR2 Keyboard Mouse Gaming Wireless Combo RX-V2,195000,10
210,Keyboard Gaming TKL Tenkeyless Fantech Fighter II K613 Rainbow Edition,175000,46
211,Rexus Keyboard Gaming Mechanical Legionare MX5.1 TKL,299000,10
212,Rexus Daiva RX-D68 Keyboard Gaming Mechanical,479000,100
213,IMPERION SLEDGEHAMMER 10 - FULL SIZE RAINBOW GAMING KEYBOARD - HITAM,115000,100
214,CORSAIR K55 RGB Gaming Keyboard,650000,4
215,Keyboard Gaming Mechanical AULA S-2022 BLACK -New LED- Macro Software,259000,63
216,Keyboard Gaming NYK K06 TKL Rainbow - NYK K-06,124000,10
217,Paket Keyboard dan Mouse Gaming Membrane HP K130 M160,168300,98
218,Keyboard Gaming Digital Alliance Meca Air S White Blue | Wireless 2.4Ghz + Bluetooth | Removeable Switches,319000,19
219,Keyboard Gaming LED Leopard,74400,100
220,NYK Keyboard Gaming K-01 TKL BackLight,121000,3130
221,Fantech K511 HUNTER PRO Gaming Keyboard,130000,18
222,ldkai 832 keyboard with Led plus mouse model gaming,99000,99
223,Palmrest Case Keyboard Asus X550-IU Gaming palresas54,250000,43
224,Keyboard Redragon Mechanical Gaming Keyboard DRAGONBORN - K630,335000,4
225,LDKAI 832 Gaming Keyboard LED with Mouse,90300,1999
226,HyperX Alloy Origins Core RGB TKL Mechanical Gaming Keyboard,1179000,9999
227,Keyboard Mouse Gaming Combo Rexus Warfaction VR1,199000,5
228,Keyboard Gaming Warwolf K1 - Ice Saber Wolf Semi Mechanical,85000,98
229,Logitech G613 Mechanical Wireless Gaming Keyboard,1199000,2
230,Nyk Nemesis Keyboard Gaming Sacred K02,105000,20
231,Leopard G700 Gaming Keyboard LED,104100,100
232,Logitech G213 Prodigy RGB Gaming Keyboard,618000,10
233,Gaming Keyboard RGB LED - R260,77300,99
234,KEYBOARD MOUSE WIRELESS - Keybord Mous Gaming Keybord Tanpa Kabel Maouse Maous Tanpa Kabel Wirelless Werles Bluetooth Tanpa Kabel Gaming Robot KM3100,149200,46
235,Keyboard Laptop Komputer Kabel USB - Keybord Kiboard Kibord Komputer PC Laptop Leptop Letop Keyboard Kabel USB Gaming Kebord [Robot RK20],90500,20
236,Waterproof Keyboard Gaming Set Mouse RGB LENYES GK01,119000,10000
237,Rexus BATTLEFIRE K9TKL Backlit Floating Keys Gaming Keyboard,166000,7
238,Logitech Pro RGB Mechanical Gaming Keyboard Game - Hitam,1449000,10
239,Keyboard Gaming Mechanical ALTEC LANSING ALGK-8404 DQ Wired RGB,302000,18
240,Fantech K511 Hunter Pro Gaming Keyboard,119000,15
241,Armaggeddon AK666X KALASHNIKOV Spill Proof Membrane Gaming Keyboard,179000,43
242,Keyboard Mouse Gaming Rexus Warfaction Vr1 Backlight 1,195000,9
243,Keyboard Gaming Rexus Battlefire K9E Wired - Rexus Battlefire RX-K9E,181000,7
244,Rexus Keyboard - Legionarz MX5.1 Keyboard Gaming,299000,4
245,Cooler Master CK530 V2 RGB TKL Mechanical Gaming Keyboard - Blue Switch,371000,20
246,Keyboard Gaming Mechanical AULA F2067 TKL K-RGD Blue Switch New LED F-2067,260000,9
247,Rexus Keyboard Gaming Mini Battlefire K68M,187000,25
248,Keyboard Leopard G700 Gaming Keyboard LED,102100,9
249,Keyboard Gaming MSI Mechanical Vigor GK30 RGB,387000,50
250,Keyboard Mouse Gaming Komic KMG-850C,125000,13
251,PAKET KEYBOARD GAMING DAN MOUSE GAMING MIXIE FREE HEADSET GAMING SY830MV,277101,99988
252,Keyboard Redragon Gaming Keyboard Mechanical RGB KUMARA - K552RGB-1,445000,3
253,Logitech G512 Carbon RGB Mechanical Gaming Keyboard - Clicky,1289000,4
254,COMBO Rexus VR3 Max Combo Keyboard Mouse Gaming Headset Warfaction,340000,25
255,Keyboard HP Pavilion gaming 15cx 15-cx 15-cx0055tx 15-cx0056wm.,110987,99
256,Aula Gaming Keyboard - Surprise Evil SK-855,280000,3
257,Logitech G213 Prodigy Gaming Keyboard,620000,2
258,Keyboard Gaming Fantech HUNTER PRO K511,129000,5
259,Keyboard gaming rexus wired type-c coil mechanical 68 keys tkl 60% rgb free switch daiva max south facing d-68sf d68 sf rx-d68sf,579000,1231
260,Fantech K511 HUNTER PRO Gaming Keyboard,130000,14
261,GROSIR Keyboard gaming game sebelah satu tangan lampu led - K108,81000,114
262,Keyboard Gaming Multimedia Membrane AULA F2028 RGB Macro Software,175000,93
263,Keyboard Gaming Armaggeddon SMK-6C RGB PSYCHKESTREL - Armagedon SMK 6C,383000,6
264,Paket Keyboard Gaming Murah 4 in 1 Marvo CM409,499000,6
265,Leopard G700 Gaming Keyboard LED Gaming Leopard Design Keren,112600,1999
266,Keyboard Gaming Armaggeddon SMK-12R RGB KESTREL - SMK12R KESTREL,565000,3
267,Keyboard Digital Alliance Meca AIR Wireless - Keyboard DA Gaming Meca,520000,10
268,Keyboard Mouse Gaming Combo Rexus Warfaction VR1,199000,97
269,ONIKUMA Paket Gaming Keyboard G25 + Mouse Kabel CW905 Pink Original,481000,2
270,Logitech G613 Wireless Mechanical Gaming Keyboard,1199000,8
271,Pulsar Xlite Wireless Cable - USB C Paracord Gaming Mouse & Keyboard,169000,30
272,ONIKUMA G27 Wired 104 Keys Backlit Mechanical Gaming Keyboard Original,520000,2
273,ONIKUMA Paket Gaming Keyboard G26 + Mouse Kabel CW905 Black Original,706000,2
274,UGREEN Mouse Desk Pad Gaming Office 80x30cm Tatakan Keyboard - 90677,79000,50
275,Keyboard Gaming Mechanical AULA S2022 BLUE   RGB Display Rainbow   Macro Software   KRGD Blue Switch   Keycap and gap backlight   uniform color,259000,100
276,Logitech G512 Carbon RGB Mechanical Gaming Keyboard - Linear Switch,1289000,2
277,COUGAR LUXLIM OPTICAL RED SWITCH EXTREME LOW PROFILE MECHANICAL GAMING KEYBOARD,1535000,49
278,KEYBOARD MOUSE WIRELESS - Keybord Mose Gaming Keybord Tanpa Kabel Mose Tanpa Kabel Mouse Bluetooth Tanpa Kabel Gaming Geming Robot KM3000,186200,99
279,Keyboard Mouse Gaming Rexus Warfaction Vr1 Backlight,195000,18
280,Armaggeddon AK666 Kalashnikov Spill Proof Backlit Membrane Gaming Keyboard - Garansi Resmi 2 Tahun,189000,98
281,Rexus Keyboard M64 Classic DAXA Keycaps Gaming Ultimate M64 RGB LED,789000,100
282,Keyboard Gaming HyperX Alloy Origins Core New Blue switch,939900,100
283,Steelseries Apex 3 Water resistant gaming keyboard,995000,1997
284,KYB-020 Single Hand RGB Keyboard Mouse Gaming PUBG MOBILE Converter Bluetooth Mix Pro 4 in 1 One Hand Keyboard G508 Konverter Konek HP,242500,100
285,Mouse & Keyboard RGB G21 Gaming Multi Color LED,80000,70
286,Keyboard ASUS TUF Gaming FX505 FX505DD FX505DT FX505U FX505DY FX505GD FX505G,580000,10
287,Keyboard gaming murah,119500,99
288,Sturdy TP822 Semi Mechanical Gaming Keyboard With Rainbow LED - Hitam,101000,49
289,Redragon Mechanical Gaming Keyboard 60% FIZZ K617-R,310000,3
290,Keyboard Gaming Mechanical RGB Backlight Mechanical Feel Waterproof,110000,300
291,Paket Keyboard Mouse Gaming NUBWO Savitar NKM-623 RGB,109000,99
292,Fantech K512 Archer 35 Keys Gaming Keyboard,149000,469
293,Keycaps mechanical pbt 108 key backlit double injection color - keycap keyboard gaming,89000,1340
294,Keyboard Gaming HP GK600YS - Blue Switch Mechanical Keyboard Full RGB - FREE Mouse M260,729000,10
295,Fantech K613 Fighter TKL Pro Gaming Keyboard,180000,3
296,AUKEY KM-P2 Tatakan Keyboard Mouse Desk Mat Pad Mousepad Mice Pc Komputer Gaming,75000,5
297,Keyboard Gaming Mechanical Aula S2022 26 Tombol Antighosting,265000,96
298,NYK KR-201 Game Master NYK KR201 NYK KR 201 Gaming Keyboard,140000,23
299,Keyboard Gaming Single Hand Semi Mechanical Rainbow Light,94000,4
300,LDKAI 832 Gaming Keyboard LED with Mouse - Black,105670,10
301,UGREEN 90677 Tatakan Keyboard Mouse Desk Mat Pad Mousepad Mice Gaming,84500,5
302,Keyboard Mouse set Gaming Rexus Warfaction Vr1 ORIGINAL Free Mouse pad,208500,25
303,Keyboard HP Mechanical Gaming GK300,503000,3
304,KEYBOARD GAMING COMBO NYK NEMESIS BASILLISK KC- 500,265000,50
305,HP K130 Gaming Keyboard,107000,30
306,Keyboard Gaming HyperX Core RGB Membrane,860000,10
307,Keyboard Gaming Mechanical ALTEC LANSING ALGK-8404 HQ Wired RGB,302000,3
308,Keyboard Gaming Mechanical Lecoo GK301 Blue Switch Anti-Ghosting,279000,50
309,Keyboard Gaming Mechanical ALTEC LANSING ALGK-8614 Wired RGB,364000,4
310,GENIUS  GAMING  KEYBOARD SCORPION K5,190000,100
311,Keyboard gaming rexus mechanical wired usb 2.0 tkl 87 keys led rainbow rgb 1ms legionare Rx mx5.2 - Keypad Mx 5.2,357000,9993
312,HyperX Alloy MKW100 Mechanical Gaming Keyboard,1155000,100
313,Digital Alliance Meca Air 68 Key RGB Mechanical Gaming Keyboard,550000,2
314,Keyboard gaming Merek sades sabre TKL RGB Membrane,188000,93938
315,Keyboard Gaming Rexus Legionare MX9P TKL Gaming Keyboard,525000,10
316,Milang T806 Keyboard Mouse Set Gaming Wired Colorful MI LANG COMBO,135000,25
317,Keyboard AOC GK200 Gaming RGB 25 Keys 1000Hz GK 200 Garansi Resmi,225000,100
318,Rexus DAXA M71 Pro RGB Wireless Mechanical Keyboard Gaming Bluetooth,845000,998
319,Keyboard Gaming Fantech Fighter K613X Gaming Keyboard RGB,179000,19
320,NYK KR-301 Underglow RGB Full Size Metal Plate Gaming Keyboard,170500,16
321,HyperX Alloy Origins 65 RGB Mechanical Gaming Keyboard,1450000,99
322,Fantech K613L Fighter II Sakura Edition Gaming Keyboard - Pink,190000,20
323,Wristpad  Fantech Pilo Wristpad Keyboard Gaming,89000,2
324,Keyboard Gaming Mechanical ALTEC LANSING ALGK-8404 Wired RGB,293000,9
325,Grosir Leopard G700 Gaming Keyboard LED,95000,400
326,Keyboard Gaming Mechanical TKL Sades Khanda Sades Khanda,370000,47
327,Leopard G20 Gaming Keyboard LED,71799,77
328,Alcatroz Silent Keyboard Mouse  Xplorer K330 Gaming Mouse -Garansi Resmi 2 Tahun,62000,40
329,Keyboard Gaming Mechanical ALTEC LANSING ALGK-8404 KQ Wired RGB,302000,1
330,Keyboard Acer Aspire Gaming E5-531 E5-531g E5-551 E5-551g E5-571E5-571g  E5-721 E5-721g E5-731 E5-731g E5-771 E5-771g,65000,999
331,Keyboard Gaming LED Leopard G20,72700,100
332,PAKET KEYBOARD MOUSE GAMING L-TECH W33 COMBO LED BLACKLIGHT LAMPU RGB,99900,99995
333,Keyboard Mouse Gaming Alcatro X-Craft XC-3000 Spill Proof RGB - Garansi Resmi 2 Tahun,139000,200
